{
  "schema_version": "hdp.nppes-baseline.v2",
  "record_type": "nppes_baseline_receipt",
  "receipt_id": "receipt:nppes:97356ea71e2175f21e350c69f59b5482",
  "producer": "healthcare-data-mcp:nppes-baseline-producer",
  "receipt_schema": "hdp.nppes-baseline-receipt.v2",
  "source_id": "source:nppes:registry",
  "source_url": "https://download.cms.gov/nppes/NPPES_Data_Dissemination.html",
  "release_id": "release:nppes:2026-08",
  "release_label": "NPPES August 2026",
  "release_sha256": "sha256:b37054ddb8678f0b0a8cb5310be3c7563c378cdffbc169e3c02cc15f79a28cbd",
  "probe_state": "changed",
  "state": "replayed",
  "final_url": "https://download.cms.gov/nppes/NPPES_Data_Dissemination.html",
  "http_status": 200,
  "recorded_at": "2026-08-29T00:00:00Z",
  "evidence_locator": "https://download.cms.gov/nppes/NPPES_Data_Dissemination.html",
  "files": [],
  "deactivation_opportunities": [],
  "deactivation_count": 0,
  "current_projection_preserved": true,
  "failure_code": null,
  "receipt_sha256": "sha256:a4f06346f9571e1b5abee181022a1478344f5a4c7865d168e54e184d0a9afd34"
}
