{
  "schema_version": "hdp.nppes-baseline.v2",
  "record_type": "nppes_baseline_receipt",
  "receipt_id": "receipt:nppes:3b817d7ecd2ff396c0bd95df14706161",
  "producer": "healthcare-data-mcp:nppes-baseline-producer",
  "receipt_schema": "hdp.nppes-baseline-receipt.v2",
  "source_id": "source:nppes:registry",
  "source_url": "https://download.cms.gov/nppes/NPPES_Data_Dissemination.html",
  "release_id": "release:nppes:2026-08",
  "release_label": "NPPES August 2026",
  "release_sha256": "sha256:bcd57920a95051ec87ea346c2eb5c8c31443383cea975a4daf859ae0b8e46b61",
  "probe_state": "not_modified",
  "state": "no_op",
  "final_url": "https://download.cms.gov/nppes/NPPES_Data_Dissemination.html",
  "http_status": 304,
  "recorded_at": "2026-08-29T00:00:00Z",
  "evidence_locator": "https://download.cms.gov/nppes/NPPES_Data_Dissemination.html",
  "files": [],
  "deactivation_opportunities": [],
  "deactivation_count": 0,
  "current_projection_preserved": true,
  "failure_code": null,
  "receipt_sha256": "sha256:8e3a7c5db619587a46180e7aa492932d53da27b38445261a3993b6a2dc0b5a68"
}
